"suminist p/impres, tintas","stept196320al","cartucho de tinta epson 196 (t196320), color magenta, para epson expression xp-101.[@", ,9.40, ,""," ","epson"
"suminist p/impres, tintas","stept504120","botella de tinta epson t504, color negro, contenido 127ml, para impresoras epson l416",>20,8.80, ,""," ","epson"
"suminist p/impres, tintas","stept504220","botella de tinta epson t504220-al, color cyan, contenido 70ml.[@@@]para impresoras ep",7,7.60, ,""," ","epson"
"suminist p/impres, tintas","stept504320","botella de tinta epson t504320-al, color magenta,contenido 70ml.[@@@]para impresoras ",>20,7.60, ,""," ","epson"
"suminist p/impres, tintas","stept504420","botella de tinta epson t504420-al, color amarillo, contenido 70ml.[@@@]para impresora",>20,7.60, ,""," ","epson"
"suminist p/impres, tintas","stept748xxl420","epson 748, capacidad extra alta.[@@@]copatible con workforce pro wf-6090, wf-6590, wf",9,72.00, ,""," ","epson"
"suminist p/impres, tintas","stept788xxl120","cartucho de tinta epson t788xxl, durabrite pro, negro, para workforce pro wf-5690/519",13,21.20, ,""," ","epson"
"suminist p/impres, tintas","stept788xxl420","cartucho de tinta epson t788xxl, durabrite pro, amarillo, para workforce pro wf-5690/",13,39.71, ,""," ","epson"
"suminist p/impres, tintas","stept913100","cartucho de tinta epson t913100, negro / foto.[@@@]compatible con:<br> impresora epso",1,97.50, ,""," ","epson"
"suminist p/impres, tintas","stept913200","cartucho de tinta epson t913200, cian, para impresora epson surecolor p5000 standard.",1,97.50, ,""," ","epson"
"suminist p/impres, tintas","stept913300","cartucho de tinta epson t913300, magenta, para impresora epson surecolor p5000 standa",1,97.50, ,""," ","epson"
"suminist p/impres, tintas","stept913400","cartucho de tinta epson t913400, amarillo, para impresora epson surecolor p5000 stand",1,97.50, ,""," ","epson"
"suminist p/impres, tintas","stept913500","cartucho de tinta epson t913500, cian claro, paraimpresora epson surecolor p5000 stan",1,97.50, ,""," ","epson"
"suminist p/impres, tintas","stept913600","cartucho de tinta epson t913600, magenta / claro.[@@@]compatible con:<br> impresora e",1,97.50, ,""," ","epson"
"suminist p/impres, tintas","stept913700","cartucho de tinta epson t913700, negro claro, para impresora epson surecolor p5000.[@",1,97.50, ,""," ","epson"
"suminist p/impres, tintas","stept913800","cartucho de tinta epson t913800, negro / mate.[@@@]compatible con:<br> impresora epso",1,97.50, ,""," ","epson"
"suminist p/impres, tintas","stept913900","cartucho de tinta epson t913900, negro / claro.[@@@]compatible con:<br> impresora eps",1,97.50, ,""," ","epson"
"suminist p/impres, tintas","stept913a00","cartucho de tinta epson t913a00, naranja, para impresora epson surecolor p5000 standa",1,97.50, ,""," ","epson"
"suminist p/impres, tintas","stept913b00","cartucho de tinta epson t913b00, verde, para impresora epson surecolor p5000 standard",1,97.50, ,""," ","epson"
"suminist p/impres, tintas","stept913d00","cartucho de tinta epson t913d00, violeta, para impresora epson surecolor p5000 standa",1,97.50, ,""," ","epson"
"suminist p/impres, tintas","steptr12x320al","bolsa de tinta epson tr12x320-al, color magenta.[@@@]tinta de pigmento durabrite ultr",4,106.34, ,""," ","epson"
"suminist p/impres, tintas","stprcancl146","cartucho de tinta canon cl-146, color.[@@@]compatible con impresoras canon pixma mg24",3,14.19, ,"consultar"," ","canon"
"suminist p/impres, tintas","stprcancl246","cartucho de tinta canon cl-246, tri-color, fine technology, 180 paginas.[@@@]compatib",>20,18.00, ,""," ","zz otras marcas"
"suminist p/impres, tintas","stprcancl31","cartucho de tinta canon cl-31 tricolor, presentación en colgador.<br>para impresoras:",13,14.79, ,"consultar"," ","canon"
"suminist p/impres, tintas","stprcancl41","cartucho de tinta canon cl-41, tricolor.[@@@]compatible con impresoras canon pixma ip",>20,16.00, ,"consultar"," ","canon"
"suminist p/impres, tintas","stprcancl54","cartucho de tinta canon cl-54, tricolor, caja.[@@@]", ,6.80, ,""," ","canon"
"suminist p/impres, tintas","stprcancl54xl","cartucho de tinta canon cl-54 xl, color.[@@@]",>20,12.03, ,""," ","canon"
"suminist p/impres, tintas","stprcancli11bk","cartucho de tinta canon cli-11 bk, negro.[@@@]para impresoras: pixma mg6310 / mg5410 ",>20,7.48, ,""," ","canon"
"suminist p/impres, tintas","stprcangi-190bk","botella de tinta canon gi-190 bk, negro[@@@]", ,6.81, ,""," ","canon"
"suminist p/impres, tintas","stprcangi-190m","botella de tinta canon gi-190 m, magenta[@@@]",>20,6.81, ,""," ","canon"
"suminist p/impres, tintas","stprcanipq3-cy","toner canon ipq-3, cyan, para imagepress c6000/c6000vp, caja.[@@@]", ,89.12, ,""," ","canon"
"suminist p/impres, tintas","stprcanipq3-mg","cartucho de toner canon ipq-3,tecnología de impresión láser, color magenta, para impr", ,89.12, ,""," ","canon"
"suminist p/impres, tintas","stprcanpg140xxl","cartucho de tinta canon pg-140xxl, 21 ml, negro.[@@@]",14,26.53, ,""," ","canon"
"suminist p/impres, tintas","stprcanpg210xl","cartucho de tinta canon pg-210 xl 15 ml.[@@@]compatible con pixma mp240 / mp250 / mp4", ,16.00, ,""," ","canon"
"suminist p/impres, tintas","stprcanpg245","cartucho de tinta canon pg-245, negro, rendimiento 180 paginas.[@@@]",>20,12.00, ,""," ","zz otras marcas"
"suminist p/impres, tintas","stprcanpgi150","cartucho de tinta canon pgi-150 pgbk, negro.[@@@]compatible con impresoras canon pixm",>20,9.22, ,""," ","canon"
"suminist p/impres, tintas","stprhpc6578d","cartucho de inyección de tinta tricolor hp n°78  para: hp deskjet - hp photosmart - h", ,36.40, ,""," ","hp suministros"
"suminist p/impres, tintas","stprhpc6625a","cartucho de tinta hp tricolor, para hp deskjet 825, 840, 841, 842, 843, 845.",6,35.90, ,""," ","hp suministros"
"suminist p/impres, tintas","stprhpc6656al","cartucho hp color negro para hp deskjet 5150/5550psc1210/2110/4110/6110 6110mf",>20,23.10, ,"consultar"," ","hp suministros"
"suminist p/impres, tintas","stprhpc8721wl","cartucho de inyeccion de tinta negra hp n°02 para: hp photosmart 3110/3210/3310/8250", ,14.50, ,""," ","hp suministros"
"suminist p/impres, tintas","stprhpc9386al","cartucho de tinta cian hp 88 (c9386al), presentación en caja", ,12.50, ,""," ","hp suministros"
"suminist p/impres, tintas","stprhpc9387al","cartucho de tinta magenta hp 88 (c9387al), presentación en caja", ,11.80, ,""," ","hp suministros"
"suminist p/impres, tintas","stprhpc9392al","cartucho de tinta magenta hp 88 (c9392al) para: hp officejet pro k550",19,23.97, ,""," ","hp suministros"
"suminist p/impres, tintas","stprhpcb320wl","cartucho de tinta amarillo hp 564 (cb320wl), cantidad 3ml, presentación en caja.",>20,9.35, ,"consultar"," ","hp suministros"
"suminist p/impres, tintas","stprhpcb338wl","cartucho de impresión inkjet tricolor hp 75xl - presentación colgador",>20,40.00, ,""," ","hp suministros"
"suminist p/impres, tintas","stprhpcn047al","cartucho de tinta hp 951xl, color: magenta, contenido: 17 ml.<br>presentacion colgado", ,26.30, ,""," ","hp suministros"
"suminist p/impres, tintas","stprhpcn057al","cartucho de tinta hp 932, negro.[@@@]presentaciónen caja.<br>", ,16.05, ,""," ","hp suministros"
"suminist p/impres, tintas","stprhpcn624am","cartucho de tinta hp 971 (cn624am), amarillo, 32 ml.[@@@]",2,55.48, ,""," ","hp suministros"
"suminist p/impres, tintas","stprhpcn627am","cartucho de tinta colot magenta de alto rendimiento hp 971xl.[@@@]presentación en caj", ,84.29, ,""," ","hp suministros"
"suminist p/impres, tintas","stprhpcz119al","cartucho de tinta hp 670xl, color magenta, para deskjet ink advantage 3525 e-all-in-o",>20,12.46, ,""," ","hp suministros"
"suminist p/impres, tintas","sumepc33s020583","cartucho de tinta epson color amarillo para impresoras epson tm-c3500.[@@@]",1,9.60, ,""," ","epson"
"_______________","_______________","__________________________________","__________"
" ","CODIGO","SUMINIST P/IMPRES, TONERS","STOCK","PREC PUBLICO US $","FLETE ","MARCA"
"suminist p/impres, toners","113r00718pj","rodillo de alimentación aadc xerox serie 9200, cantidad 100 hojas, para workcentre 57",>20,5.06, ,"consultar"," ","xerox"
"suminist p/impres, toners","stept748xxl220","epson t748xxl cartucho de tinta color cyan durabrite pro de alta capacidad extra.[@@@",2,55.00, ,""," ","epson"
"suminist p/impres, toners","stept748xxl320","cartucho de tinta epson 748xxl, magenta, alto rendimiento, para epson workforce pro.[",2,55.00, ,""," ","epson"
"suminist p/impres, toners","stprcan116black","cartucho de toner canon 116 black, compatible conlbp5050 / color imageclass mf8050cn,",3,55.54, ,""," ","canon"
"suminist p/impres, toners","stprcangpr37bk","cartucho de toner canon gpr-37, tecnología de impresión láser, color negro.[@@@]para ", ,53.33, ,""," ","canon"
"suminist p/impres, toners","stprcanpfi-106m","cartucho de tinta canon pfi-106, 130ml, magenta.[@@@]compatible con canon  imageprogr", ,72.83, ,""," ","canon"
"suminist p/impres, toners","stprhpq1339a","tóner hp negro 39a para laserjet  serie 4300",9,150.00, ,""," ","hp suministros"
"suminist p/impres, toners","stprhpq6460a","cartucho de impresión hp color laserjet, negro (q6460a) para impresoras hp color lase",14,90.00, ,""," ","hp suministros"
"suminist p/impres, toners","stprhpq6461a","cartucho de impresión cian hp color laserjet (q6461a), presentación en caja.",4,150.00, ,""," ","hp suministros"
"suminist p/impres, toners","stprhpq6463a","cartucho de impresión magenta hp color laserjet (q6463a), presentación en caja.",5,150.00, ,""," ","hp suministros"
"suminist p/impres, toners","stprsamml2550-b","cartucho de tóner samsung ml-2550da, tecnología láser, negro.[@@@]para impresoras sam",7,84.89, ,""," ","samsung"
"suminist p/impres, toners","stprsamml2550da","cartucho de toner samsung ml-2550da, tecnólogia laser, color negro,   para las series",>20,50.00, ,""," ","samsung"
"suminist p/impres, toners","stprxe113r00628","tóner  xerox para ph4400",4,187.96, ,""," ","xerox"
"suminist p/impres, toners","stsammltd307u","cartucho de toner samsung mlt-d307u , negro, presentación en caja[@@@]compatible con ",>20,243.00, ,""," ","samsung"
"suminist p/impres, toners","stxe006r01007","cartucho de toner xerox (006r01007), color negro,contenido  2 cartuchos, presentación",1,111.40, ,""," ","xerox"
"suminist p/impres, toners","stxe006r01046","cartucho de toner xerox negro, para workcentre y copycentre, presentación en caja",>20,57.91, ,""," ","xerox"
"suminist p/impres, toners","stxe006r01123","toner xerox color cyan, para impresora docucolor 2240/1632/3535 copycentre & workcent",1,153.50, ,""," ","xerox"
"suminist p/impres, toners","stxe006r01124","toner xerox color magenta, para impresora docucolor 2240/1632/3535 copycentre & workc",2,154.20, ,""," ","xerox"
"suminist p/impres, toners","stxe006r01125","cartucho de toner xerox amarillo,presentación en caja",2,155.00, ,""," ","xerox"
"suminist p/impres, toners","stxe006r01177","cartucho xerox magenta, para xerox workcentre/copycentre c2128/c2636/c3545",1,151.16, ,""," ","xerox"
"suminist p/impres, toners","stxe006r01319","xerox black toner cartridge (006r01319) workcentre 7132",2,85.08, ,""," ","xerox"
"suminist p/impres, toners","stxe006r01387","cartucho de reemplazo xerox, para hp laserjet p2015 series/m2727, negro.[@@@]presenta",6,84.06, ,""," ","xerox - original para hp"
"suminist p/impres, toners","stxe006r01401","cartucho de toner xerox (006r01401), color magenta, capacidad 15 000 páginas , presen",1,145.20, ,""," ","xerox"
"suminist p/impres, toners","stxe006r01402","cartucho de toner xerox (006r01402), color cyan, capacidad 15000 páginas , presentaci",1,145.00, ,""," ","xerox"
"suminist p/impres, toners","stxe006r01490","cartucho de reemplazo xerox, para hp laserjet p2055 series, negro.[@@@]presentación e",>20,50.00, ,""," ","xerox - original para hp"
"suminist p/impres, toners","stxe006r01520","torner xerox cyan sold dmo 006r01520, presentación en caja.[@@@]compatible con workce",1,109.04, ,""," ","xerox"
"suminist p/impres, toners","stxe006r03008bl","cartucho de tóner xerox 006r03011, negro, presentación en caja.[@@@]para hp colour la",13,70.00, ,""," ","xerox - original para hp"
"suminist p/impres, toners","stxe006r03014","cartucho de tóner xerox 006r03014, negro, para hplaserjet m351a m375nw mfp/m451/m475 ",2,49.00, ,""," ","xerox - original para hp"
"suminist p/impres, toners","stxe006r03017","cartucho de tóner xerox 006r03017, yellow, presentación en caja.[@@@]para hp colour l",5,55.70, ,""," ","xerox - original para hp"
"suminist p/impres, toners","stxe006r03244","cartucho de tóner xerox 006r03244, amarillo, hp colour laserjet pro mfp m176/m177 ser",10,32.90, ,""," ","xerox - original para hp"
"suminist p/impres, toners","stxe006r03245","cartucho de tóner xerox 006r03245, magenta, hp colour laserjet pro mfp m176/m177 seri",>20,32.93, ,""," ","xerox - original para hp"
"suminist p/impres, toners","stxe008r12903","contenedor de tóner usado wc m24/docucolor 2240",2,28.15, ,""," ","xerox"
"suminist p/impres, toners","stxe008r12941","pack de 3 cartucho de grapas xerox 008r12941, 5000 grapas por cartucho, en caja.[@@@]",12,56.35, ,""," ","xerox"
"suminist p/impres, toners","stxe008r13028","fusor xerox workcentre 7228/7235/7245, presentación en caja",2,234.34, ,""," ","xerox"
"suminist p/impres, toners","stxe008r13040","fusor xerox 008r13040, para workcentre 7328/7335/7345, presentacion en caja",2,234.21, ,""," ","xerox"
"suminist p/impres, toners","stxe013r00623","xerox cartucho de tambor para workcentre 4150 (55.000 impresiones al 5% de cobertura)",3,304.69, ,""," ","xerox"
"suminist p/impres, toners","stxe013r00624","xerox cartucho de impresión (013r00624) workcentre 7328/7335/7345",2,96.92, ,""," ","xerox"
"suminist p/impres, toners","stxe016199600","tambor de imagen negro xerox 016199600, compatible con phaser® 7300, 30.000 pag. apro",1,5.00, ,""," ","xerox"
"suminist p/impres, toners","stxe101r00024","cartucho de toner copiado/impresión xerox, color negro, para impresora workcentre pro",2,149.00, ,""," ","xerox"
"suminist p/impres, toners","stxe106r00584-b","cartucho de toner xerox 106r00584, negro, para impresora workcentre 312/m15/m15i.[@@@",1,50.00, ,""," ","xerox"
"suminist p/impres, toners","stxe106r00653","cartucho de toner xerox color cyan, para impresora color laser phaser 7750, presentac",1,267.32, ,""," ","xerox"
"suminist p/impres, toners","stxe106r00654","cartucho de toner xerox color magenta, para impresora color laser phaser 7750, presen",2,268.27, ,""," ","xerox"
"suminist p/impres, toners","stxe106r00670","xerox standard capacity print cartridge, amarillo, phaser 6250 (106r00670) 4,000 pag.",10,130.59, ,""," ","xerox"
"suminist p/impres, toners","stxe106r00672","cartucho toner de impresión xerox, color cyan,para impresora láser de color phaser 62",4,189.97, ,""," ","xerox"
"suminist p/impres, toners","stxe106r00673","cartucho toner de impresión xerox, color magenta,para impresora láser de color phaser",3,189.79, ,""," ","xerox"
"suminist p/impres, toners","stxe106r00674","cartucho toner de impresión xerox, color amarillo, para impresora láser de color phas",1,189.89, ,""," ","xerox"
"suminist p/impres, toners","stxe106r00680"," xerox high-capacity toner cartridge (cyan) para impresora laser a color phaser 6100,",1,127.04, ,""," ","xerox"
"suminist p/impres, toners","stxe106r00684"," xerox high-capacity toner cartridge (negro) para impresora laser a color phaser 6100",5,101.97, ,""," ","xerox"
"suminist p/impres, toners","stxe106r010-oem","cartucho de toner xerox 106r01047, negro, para copycentre c20 / workcentre m20/m20i.[",1,72.93, ,""," ","xerox"
"suminist p/impres, toners","stxe106r01047","cartucho de toner xerox, color negro, para copycentre c20/m20/m20i, presentación en c",9,75.17, ,""," ","xerox"
"suminist p/impres, toners","stxe106r01077","xerox toner cartridge cyan high-capacity phaser 7400 - presentación en caja",1,328.74, ,""," ","xerox"
"suminist p/impres, toners","stxe106r01080","cartucho de tóner xerox, para impresora phaser 7400, presentación en caja. color negr",3,128.12, ,""," ","xerox"
"suminist p/impres, toners","stxe106r01145","cartucho de tóner xerox, color magenta, para impresora phaser 6350, presentación en c",1,231.20, ,""," ","xerox"
"suminist p/impres, toners","stxe106r01147","cartucho de toner xerox phaser 6350, color negro, para impresora xerox phaser 6350, p",4,91.63, ,""," ","xerox"
"suminist p/impres, toners","stxe106r01203","cartucho de toner xerox, color negro, para impresora phaser 6110, presentaciónen caja",3,49.49, ,""," ","xerox"
"suminist p/impres, toners","stxe106r01278","xerox cartucho de tóner cyan para phaser 6130 - presentación en caja",1,80.18, ,""," ","xerox"
"suminist p/impres, toners","stxe106r01317","cartucho de toner de alta capacidad xerox 106r01317, tecnología láser, color cián, pa",1,302.48, ,""," ","xerox"
"suminist p/impres, toners","stxe106r01318","cartucho de toner de alta capacidad xerox 106r01318, tecnología láser, color magenta,",1,302.48, ,""," ","xerox"
"suminist p/impres, toners","stxe106r01412","cartucho de impresión de gran capacidad (8000 págs.) xerox (106r01412), presentación ",>20,70.00, ,""," ","xerox"
"suminist p/impres, toners","stxe106r01440","cartucho de toner xerox 106r01440, cyan, para phaser 7500.[@@@]capacidad estándar.<br",3,273.01, ,""," ","xerox"
"suminist p/impres, toners","stxe106r01475","cartucho de toner xerox de alta capacidad (106r01475), color amarillo, capacidad 2600",1,109.75, ,""," ","xerox"
"suminist p/impres, toners","stxe106r01484","cartucho toner xerox (106r01484), phaser 6140-d, color negro, para impresora phaser 6",1,71.78, ,""," ","xerox"
"suminist p/impres, toners","stxe106r01525","cartucho de toner xerox, color amarillo, tecnología de impresión láser, para impresor",1,179.00, ,""," ","xerox"
"suminist p/impres, toners","stxe106r01598","cartucho de tóner xerox, color cyan, compatible con phaser 6500/workcentre 6505.",4,50.00, ,""," ","xerox"
"suminist p/impres, toners","stxe106r01600","cartucho de tóner xerox, color amarillo, compatible con phaser 6500/workcentre 6505.",4,49.00, ,""," ","xerox"
"suminist p/impres, toners","stxe106r01602","cartucho de tóner xerox, color magenta, para phaser 6500/workcentre 6505.",12,77.00, ,""," ","xerox"
"suminist p/impres, toners","stxe106r01603","cartucho de tóner xerox, color amarillo, compatible con phaser 6500/workcentre 6505.",4,70.20, ,""," ","xerox"
"suminist p/impres, toners","stxe106r01633","cartucho de tóner xerox, color amarillo, compatible con phaser 6000/6010.",19,42.41, ,""," ","xerox"
"suminist p/impres, toners","stxe106r0223-b","cartucho toner xerox 106r02238, magenta, workcentre 6605 / phaser 6600.[@@@]presentac",1,231.50, ,""," ","xerox"
"suminist p/impres, toners","stxe106r02237-b","cartucho toner xerox 106r02237, cyan, workcentre 6605 / phaser 6600.[@@@]presentación",1,231.50, ,""," ","xerox"
"suminist p/impres, toners","stxe106r02631","cartucho de tóner xerox 106r02631, negro, para hplaserjet 600 m601/602/603/ m4555 mfp",4,77.54, ,""," ","xerox - original para hp"
"suminist p/impres, toners","stxe106r02632","cartucho de reemplazo xerox 106r02632, para hp laserjet m4555 mfp series, negro[@@@]c",16,60.00, ,""," ","xerox - original para hp"
"suminist p/impres, toners","stxe106r02753","cartucho de tóner xerox 106r02753, capacidad 7500, para workcentre 6655.[@@@]",1,172.05, ,""," ","xerox"
"suminist p/impres, toners","stxe108r00593","unidad de imagen (23,000 paginas), para xerox phaser 6100, presentacion en caja",2,166.49, ,""," ","xerox"
"suminist p/impres, toners","stxe108r00594","cinta de transferencia xerox, 50000 imagenes aprox, presentación en caja",1,186.10, ,""," ","xerox"
"suminist p/impres, toners","stxe108r00608","cartucho de impresión xerox, tinta sólida, color negro, para impresora phaser 8400, p",1,92.83, ,""," ","xerox"
"suminist p/impres, toners","stxe108r00648","xerox magenta imaging unit (unidad de imagen magenta) para impresora laser a color ph",1,221.84, ,""," ","xerox"
"suminist p/impres, toners","stxe108r00649","drum xerox phaser 7400, color amarillo, para impresora xerox phaser 7400, presentació",1,217.78, ,""," ","xerox"
"suminist p/impres, toners","stxe108r00650","drum xerox phaser 7400, color negro, para impresora xerox phaser 7400, presentación e",6,132.37, ,""," ","xerox"
"suminist p/impres, toners","stxe108r00669","cartucho de impresión xerox, tinta sólida, color cyan, para impresora phaser 8500/855",3,91.70, ,""," ","xerox"
"suminist p/impres, toners","stxe108r00722","cartucho de desechos, para impresora phaser 6110,presentación en caja.",1,13.92, ,""," ","xerox"
"suminist p/impres, toners","stxe108r00725-b","cartucho de tinta solida xerox 108r00725, amarillo, para xerox phaser 8560/ 8560mfp.[",2,5.00, ,""," ","xerox"
"suminist p/impres, toners","stxe108r00765-b","tinta solida xerox 108r00765, magenta, phaser 8560, presentación en caja.[@@@]",1,79.21, ,""," ","xerox"
"suminist p/impres, toners","stxe108r00839","genuine xerox cq ink, amarillo , dmo, 4 sticks",2,157.35, ,""," ","xerox"
"suminist p/impres, toners","stxe108r00840","tinta cq  xerox 108r00840, color negro, dmo, 4 sticks",2,157.35, ,""," ","xerox"
"suminist p/impres, toners","stxe108r01027","cartucho de impresion xerox metered ink, para colorqube 8900, color magenta.[@@@]",2,96.56, ,""," ","xerox"
"suminist p/impres, toners","stxe108r01028","cartucho de impresion xerox metered ink, para colorqube 8900, color amarillo[@@@]",1,95.50, ,""," ","xerox"
"suminist p/impres, toners","stxe113r00173","cartucho toner de impresión láser xerox, color negro, para docuprint n24/n32/n40/n322",2,231.13, ,""," ","xerox"
"suminist p/impres, toners","stxe113r00321","cartucho toner de copiado/impresión xerox, color negro, para documentcentre 440/432/4",6,187.75, ,""," ","xerox"
"suminist p/impres, toners","stxe113r00489","drum cartridge xerox (cartucho de tambor), para impresora/copiadora  xerox workcentre",2,134.61, ,""," ","xerox"
"suminist p/impres, toners","stxe113r00495","cartucho toner de impresión xerox, color negro, para impresora phaser 5400, presentac",5,212.31, ,""," ","xerox"
"suminist p/impres, toners","stxe113r00610","xerox módulo xerográfico unidad de transferencia 113r00610, para workcentre 5638/5632",2,190.00, ,""," ","xerox"
"suminist p/impres, toners","stxe113r00657","cartucho de toner xerox, color negro, para impresora phaser 4500, presentación en caj",>20,180.00, ,""," ","xerox"
"suminist p/impres, toners","stxe113r00693","cartucho de toner xerox cyan, para impresora phaser 6120, presentación en caja",2,167.01, ,""," ","xerox"
"suminist p/impres, toners","stxe113r00694","cartucho de toner xerox amarillo, para impresora phaser 6120, presentación en caja",1,151.72, ,""," ","xerox"
"suminist p/impres, toners","stxe113r00695","cartucho de toner xerox magenta, para impresora phaser 6120, presentación en caja",1,150.68, ,""," ","xerox"
"suminist p/impres, toners","stxe113r00718","workcentre 5645/5687 dadh juego de rodillo de alim. (100 hojas), se usa con workcentr",2,13.94, ,""," ","xerox"
"suminist p/impres, toners","stxe115r00030","xerox fusor 220v (115r00030) para phaser 6250, capacidad 100,000 pag.  - presentación",1,176.25, ,""," ","xerox"
"suminist p/impres, toners","stxe115r00037","tóner xerox (115r00037), compatible phaser 7400. presentación en caja.<br>",1,189.50, ,""," ","xerox"
"suminist p/impres, toners","stxe16180000","cartucho de tóner xerox (16180000), color cyan, para impresoras phaser 750.",2,225.32, ,""," ","xerox"
"suminist p/impres, toners","stxe16180100","cartucho de tóner xerox (16180100), color magenta, para impresoras phaser 750.",1,225.00, ,""," ","xerox"
"suminist p/impres, toners","stxe16180200","cartucho de tóner xerox (16180200), color amarillo, para impresoras phaser 750.",2,225.32, ,""," ","xerox"
"suminist p/impres, toners","stxe16180301","cartucho de tóner xerox (16180301), color negro, para impresoras phaser 750.",2,103.12, ,""," ","xerox"
"suminist p/impres, toners","stxe16199600","drum xerox phaser black para xerox 7300.",1,153.62, ,""," ","xerox"
"suminist p/impres, toners","stxe16201200","unidad de imagen (30,000 páginas) para impresora láser de color xerox phaser 6200",1,270.25, ,""," ","xerox"
"suminist p/impres, toners","stxe16204500","cartucho de impresión xerox, color cyan, para impresora phaser 8200, presentación en ",3,159.00, ,""," ","xerox"
"suminist p/impres, toners","stxee006r01176","cartucho de toner xerox 006r01176 , color cyan, presentación en caja.[@@@]para workce",1,157.21, ,""," ","xerox"
"_______________","_______________","__________________________________","__________"
" ","CODIGO","T CELULARES BASICOS","STOCK","PREC PUBLICO US $","FLETE ","MARCA"
"t celulares basicos","tcal1066dblk","celular alcatel 1066d, 1.8, desbloqueado, fm radio, mp3, dual sim.[@@@]bandas: gsm q",>20,10.40, ,""," ","alcatel"
"t celulares basicos","tccelm137blue","teléfono celular básico cellacom m137, 1.77, gsm, dual sim, radio fm, desbloqueado.[", ,7.90, ,""," ","cellacom"
"t celulares basicos","tccelm137red","teléfono celular básico cellacom m137, 1.77, gsm, dual sim, radio fm, desbloqueado.[",>20,7.90, ,""," ","cellacom"
"t celulares basicos","tceneem100blk","teléfono celular básico energizer 100, 2.4 qvga,gsm, dual sim, desbloqueado.[@@@]ban",>20,36.34, ,""," ","energizer"
"t celulares basicos","tcfpidvid5050bk","teléfono celular básico intense devices id5050, 1.77, dual sim, radio fm, desbloquea",>20,15.50, ,""," ","intense devices"
"t celulares basicos","tcfpidvid5050rd","teléfono celular básico intense devices id5050, 1.77, dual sim, radio fm, desbloquea",>20,15.50, ,""," ","intense devices"
"t celulares basicos","tcfplblt2448blk","teléfono celular básico landbyte lt2448, 1.77, 128x160, dual sim, radio fm, desbloqu", ,12.20, ,""," ","landbyte"
